<?xml version="1.0" encoding="UTF-8"?>
<!--Sample XML file generated by XMLSpy v2010 (http://www.altova.com)-->
<FieldTestDataReport isFinal="false" xsi:schemaLocation="http://aphis.usda.gov/epermits/XML_SCHEMA/FieldTestDataReport ..\schemas\FieldTestDataReport.xsd" xmlns="http://aphis.usda.gov/epermits/XML_SCHEMA/FieldTestDataReport" xmlns:xsi="http://www.w3.org/2001/XMLSchema-instance">
	<ApplicationId>10-348-105r</ApplicationId>
	<FieldTestData>
		<LocationUniqueId>[Location1]</LocationUniqueId>
		<Harvested>
			<HarvestDate>2010-12-11</HarvestDate>
			<InFieldTermination>
				<TerminationDate>2010-12-15</TerminationDate>
				<Description>a</Description>
			</InFieldTermination>
			<OffFieldTermination>
				<Stored>
					<Quantity>2</Quantity>
					<Units>acres</Units>
					<Description>off field termination</Description>
				</Stored>
				<OffFieldDestruction>
					<DestructionDate>2010-12-11</DestructionDate>
					<Description>Test</Description>
				</OffFieldDestruction>
			</OffFieldTermination>
		</Harvested>
		<DestroyedBeforeHarvest>
				<DestructionDate>2010-12-20></DestructionDate>
				<Description>test</Description>
		</DestroyedBeforeHarvest>
		<StillGrowing>
			<StillGrowingQuantity>3</StillGrowingQuantity>
			<StillGrowingDescription>Test</StillGrowingDescription>
		</StillGrowing>
		<Explanation>Reasons go here</Explanation>
		<DispositionMethods>DispositionMethods XML Text for location </DispositionMethods>
		<UnintendedEffects>UnintendedEffects XML Text  for location </UnintendedEffects>
		<UnusualOccurrences>UnusualOccurrences XML Text  for location </UnusualOccurrences>
		<CropObservations>CropObservations XML Text  for location </CropObservations>
		<Comments>Comments XML Text  for location </Comments>
	</FieldTestData>
</FieldTestDataReport>
